{"kind":"bpmnSourceOverlay","id":"invoice-handlers","semanticProfile":"cibseven-2.2.0-serial-business-tasks-draft","effectBindings":[{"source":{"implementation":"urn:bpmn-lean:effect-protocol:activity-v1","delegateExpression":"${invoiceClassifier}"},"descriptor":{"protocol":"urn:bpmn-lean:effect-protocol:activity-v1","operation":"invoiceClassifier"}},{"source":{"implementation":"urn:bpmn-lean:effect-protocol:activity-v1","delegateExpression":"${invoiceValidator}"},"descriptor":{"protocol":"urn:bpmn-lean:effect-protocol:activity-v1","operation":"invoiceValidator"}}],"inertAttributes":[]}