{"kind":"bpmnSourceOverlay","id":"purchase-order-handlers","semanticProfile":"cibseven-2.2.0-nested-embedded-scope-data-draft","effectBindings":[{"source":{"implementation":"urn:bpmn-lean:effect-protocol:activity-v1","delegateExpression":"${approveOrder}"},"descriptor":{"protocol":"urn:bpmn-lean:effect-protocol:activity-v1","operation":"approveOrder"}},{"source":{"implementation":"urn:bpmn-lean:effect-protocol:activity-v1","delegateExpression":"${checkCompliance}"},"descriptor":{"protocol":"urn:bpmn-lean:effect-protocol:activity-v1","operation":"checkCompliance"}},{"source":{"implementation":"urn:bpmn-lean:effect-protocol:activity-v1","delegateExpression":"${publishOrder}"},"descriptor":{"protocol":"urn:bpmn-lean:effect-protocol:activity-v1","operation":"publishOrder"}}],"inertAttributes":[]}