{"kind":"bpmnSourceOverlay","id":"invoice-handlers","semanticProfile":"cibseven-2.2.0-mixed-task-control-flow-draft","effectBindings":[{"source":{"implementation":"urn:bpmn-lean:effect-protocol:activity-v1","delegateExpression":"${invoiceValidator}"},"descriptor":{"protocol":"urn:bpmn-lean:effect-protocol:activity-v1","operation":"invoiceValidator"}}],"inertAttributes":[]}