{"kind":"bpmnSourceOverlay","id":"supplier-screening-handlers","semanticProfile":"cibseven-2.2.0-embedded-subprocess-completion-draft","effectBindings":[{"source":{"implementation":"urn:bpmn-lean:effect-protocol:activity-v1","delegateExpression":"${bankAccountVerification}"},"descriptor":{"protocol":"urn:bpmn-lean:effect-protocol:activity-v1","operation":"bankAccountVerification"}},{"source":{"implementation":"urn:bpmn-lean:effect-protocol:activity-v1","delegateExpression":"${sanctionsScreening}"},"descriptor":{"protocol":"urn:bpmn-lean:effect-protocol:activity-v1","operation":"sanctionsScreening"}},{"source":{"implementation":"urn:bpmn-lean:effect-protocol:activity-v1","delegateExpression":"${supplierActivation}"},"descriptor":{"protocol":"urn:bpmn-lean:effect-protocol:activity-v1","operation":"supplierActivation"}}],"inertAttributes":[]}