{"kind":"bpmnSourceOverlay","id":"claim-intake-handlers","semanticProfile":"cibseven-2.2.0-embedded-subprocess-completion-draft","effectBindings":[{"source":{"implementation":"urn:bpmn-lean:effect-protocol:activity-v1","delegateExpression":"${damagePricing}"},"descriptor":{"protocol":"urn:bpmn-lean:effect-protocol:activity-v1","operation":"damagePricing"}},{"source":{"implementation":"urn:bpmn-lean:effect-protocol:activity-v1","delegateExpression":"${policyLookup}"},"descriptor":{"protocol":"urn:bpmn-lean:effect-protocol:activity-v1","operation":"policyLookup"}}],"inertAttributes":[]}