{"kind":"bpmnSourceOverlay","id":"credit-handlers","semanticProfile":"cibseven-2.2.0-portable-business-effect-data-draft","effectBindings":[{"source":{"implementation":"urn:bpmn-lean:effect-protocol:activity-v1","delegateExpression":"${assessCredit}"},"descriptor":{"protocol":"urn:bpmn-lean:effect-protocol:activity-v1","operation":"assessCredit"}},{"source":{"implementation":"urn:bpmn-lean:effect-protocol:activity-v1","delegateExpression":"${notifyApplicant}"},"descriptor":{"protocol":"urn:bpmn-lean:effect-protocol:activity-v1","operation":"notifyApplicant"}}],"inertAttributes":[]}